{
  "$schema": "https://crossforge.dev/schemas/sysroot-lock.schema.json",
  "schema_version": 1,
  "kind": "sysroot-lock",
  "identity": {
    "distribution": "rocky",
    "release": "8.10",
    "baseline": "el8",
    "arch": "x86_64",
    "target_triple": "x86_64-unknown-linux-gnu"
  },
  "solver": {
    "implementation": "dnf",
    "image": "quay.io/rockylinux/rockylinux:8",
    "image_digest": "sha256:e8a49c5403b687db05d4d67333fa45808fbe74f36e683cec7abb1f7d0f2338c6",
    "dnf_version": "4.7.0-20.el8",
    "libdnf_version": "0.63.0-19.el8",
    "rpm_version": "4.14.3",
    "allowed_arches": [
      "x86_64",
      "noarch"
    ],
    "install_weak_deps": false,
    "best": true,
    "strict": true,
    "allow_erasing": false
  },
  "repositories": [
    {
      "id": "baseos",
      "baseurl": "https://download.rockylinux.org/pub/rocky/8.10/BaseOS/x86_64/os/",
      "repomd_sha256": "fa8241701bc96b403fbefdd23bd9563c75ca4b252cadde62a2c3845581e126d7",
      "metadata": [
        {
          "type": "primary",
          "location": "repodata/9499d683a6515b570082586dbfbe50b4b52c47a3345d240e060bc8dc448feeb0-primary.xml.gz",
          "checksum": {
            "algorithm": "sha256",
            "value": "9499d683a6515b570082586dbfbe50b4b52c47a3345d240e060bc8dc448feeb0"
          }
        },
        {
          "type": "primary_db",
          "location": "repodata/b23ee61ba974d0b0ac29b8b8b53f40b53e504c07bf1821b9c6571f58b5036417-primary.sqlite.xz",
          "checksum": {
            "algorithm": "sha256",
            "value": "b23ee61ba974d0b0ac29b8b8b53f40b53e504c07bf1821b9c6571f58b5036417"
          }
        }
      ],
      "gpg_key": {
        "sha256": "ef1ca99bba38bb2869a06fbf46860fcdaeece796be98f8dfb0160b84bdbc69ab",
        "fingerprint": "7051c470a929f454cebe37b715af5dac6d745a60"
      }
    }
  ],
  "roots": [
    {
      "name": "glibc",
      "arch": "x86_64",
      "purpose": "c-runtime"
    },
    {
      "name": "glibc-devel",
      "arch": "x86_64",
      "purpose": "c-runtime"
    },
    {
      "name": "glibc-headers",
      "arch": "x86_64",
      "purpose": "c-runtime"
    },
    {
      "name": "glibc-minimal-langpack",
      "arch": "x86_64",
      "purpose": "c-runtime"
    },
    {
      "name": "kernel-headers",
      "arch": "x86_64",
      "purpose": "c-runtime"
    },
    {
      "name": "libgcc",
      "arch": "x86_64",
      "purpose": "c-runtime"
    },
    {
      "name": "libstdc++",
      "arch": "x86_64",
      "purpose": "c-runtime"
    },
    {
      "name": "bzip2-devel",
      "arch": "x86_64",
      "purpose": "python"
    },
    {
      "name": "libffi-devel",
      "arch": "x86_64",
      "purpose": "python"
    },
    {
      "name": "libuuid-devel",
      "arch": "x86_64",
      "purpose": "python"
    },
    {
      "name": "openssl-devel",
      "arch": "x86_64",
      "purpose": "python"
    },
    {
      "name": "sqlite-devel",
      "arch": "x86_64",
      "purpose": "python"
    },
    {
      "name": "xz-devel",
      "arch": "x86_64",
      "purpose": "python"
    },
    {
      "name": "zlib-devel",
      "arch": "x86_64",
      "purpose": "python"
    }
  ],
  "packages": [
    {
      "name": "basesystem",
      "epoch": 0,
      "version": "11",
      "release": "5.el8",
      "arch": "noarch",
      "nevra": "basesystem-0:11-5.el8.noarch",
      "repo_id": "baseos",
      "location": "Packages/b/basesystem-11-5.el8.noarch.rpm",
      "url": "https://download.rockylinux.org/pub/rocky/8.10/BaseOS/x86_64/os/Packages/b/basesystem-11-5.el8.noarch.rpm",
      "repository_checksum": {
        "algorithm": "sha256",
        "value": "4bcb501bf3759efe4a6acb3313d90852205e2536760cbcdba74be356847960b2"
      },
      "sha256": "4bcb501bf3759efe4a6acb3313d90852205e2536760cbcdba74be356847960b2",
      "size": 9552,
      "install_size": 0,
      "source_rpm": "basesystem-11-5.el8.src.rpm",
      "signing_key_fingerprint": "7051c470a929f454cebe37b715af5dac6d745a60",
      "reason": "dependency"
    },
    {
      "name": "bash",
      "epoch": 0,
      "version": "4.4.20",
      "release": "6.el8_10",
      "arch": "x86_64",
      "nevra": "bash-0:4.4.20-6.el8_10.x86_64",
      "repo_id": "baseos",
      "location": "Packages/b/bash-4.4.20-6.el8_10.x86_64.rpm",
      "url": "https://download.rockylinux.org/pub/rocky/8.10/BaseOS/x86_64/os/Packages/b/bash-4.4.20-6.el8_10.x86_64.rpm",
      "repository_checksum": {
        "algorithm": "sha256",
        "value": "d8eeec92a3264b9d4671221441de603d7f622d61845ac2e16bbcdb2bb87a57fb"
      },
      "sha256": "d8eeec92a3264b9d4671221441de603d7f622d61845ac2e16bbcdb2bb87a57fb",
      "size": 1621652,
      "install_size": 6865564,
      "source_rpm": "bash-4.4.20-6.el8_10.src.rpm",
      "signing_key_fingerprint": "7051c470a929f454cebe37b715af5dac6d745a60",
      "reason": "dependency"
    },
    {
      "name": "bzip2-devel",
      "epoch": 0,
      "version": "1.0.6",
      "release": "28.el8_10",
      "arch": "x86_64",
      "nevra": "bzip2-devel-0:1.0.6-28.el8_10.x86_64",
      "repo_id": "baseos",
      "location": "Packages/b/bzip2-devel-1.0.6-28.el8_10.x86_64.rpm",
      "url": "https://download.rockylinux.org/pub/rocky/8.10/BaseOS/x86_64/os/Packages/b/bzip2-devel-1.0.6-28.el8_10.x86_64.rpm",
      "repository_checksum": {
        "algorithm": "sha256",
        "value": "45085dd82dbc6423ed9fd40f16efbd7c5cf12a96ee01d12532fce43ae6279fc3"
      },
      "sha256": "45085dd82dbc6423ed9fd40f16efbd7c5cf12a96ee01d12532fce43ae6279fc3",
      "size": 229068,
      "install_size": 391358,
      "source_rpm": "bzip2-1.0.6-28.el8_10.src.rpm",
      "signing_key_fingerprint": "7051c470a929f454cebe37b715af5dac6d745a60",
      "reason": "root"
    },
    {
      "name": "bzip2-libs",
      "epoch": 0,
      "version": "1.0.6",
      "release": "28.el8_10",
      "arch": "x86_64",
      "nevra": "bzip2-libs-0:1.0.6-28.el8_10.x86_64",
      "repo_id": "baseos",
      "location": "Packages/b/bzip2-libs-1.0.6-28.el8_10.x86_64.rpm",
      "url": "https://download.rockylinux.org/pub/rocky/8.10/BaseOS/x86_64/os/Packages/b/bzip2-libs-1.0.6-28.el8_10.x86_64.rpm",
      "repository_checksum": {
        "algorithm": "sha256",
        "value": "14ecb4995555392bd45644630196b6f864d93dba9c56133bb96f199841852ad0"
      },
      "sha256": "14ecb4995555392bd45644630196b6f864d93dba9c56133bb96f199841852ad0",
      "size": 48232,
      "install_size": 75061,
      "source_rpm": "bzip2-1.0.6-28.el8_10.src.rpm",
      "signing_key_fingerprint": "7051c470a929f454cebe37b715af5dac6d745a60",
      "reason": "dependency"
    },
    {
      "name": "ca-certificates",
      "epoch": 0,
      "version": "2025.2.80_v9.0.304",
      "release": "80.2.el8_10",
      "arch": "noarch",
      "nevra": "ca-certificates-0:2025.2.80_v9.0.304-80.2.el8_10.noarch",
      "repo_id": "baseos",
      "location": "Packages/c/ca-certificates-2025.2.80_v9.0.304-80.2.el8_10.noarch.rpm",
      "url": "https://download.rockylinux.org/pub/rocky/8.10/BaseOS/x86_64/os/Packages/c/ca-certificates-2025.2.80_v9.0.304-80.2.el8_10.noarch.rpm",
      "repository_checksum": {
        "algorithm": "sha256",
        "value": "a2ea363d0a733b4550d7401ee7fb81fd9b66124bf4955feee7ff605dfdec3c1b"
      },
      "sha256": "a2ea363d0a733b4550d7401ee7fb81fd9b66124bf4955feee7ff605dfdec3c1b",
      "size": 1047896,
      "install_size": 2542397,
      "source_rpm": "ca-certificates-2025.2.80_v9.0.304-80.2.el8_10.src.rpm",
      "signing_key_fingerprint": "7051c470a929f454cebe37b715af5dac6d745a60",
      "reason": "dependency"
    },
    {
      "name": "chkconfig",
      "epoch": 0,
      "version": "1.19.2",
      "release": "1.el8",
      "arch": "x86_64",
      "nevra": "chkconfig-0:1.19.2-1.el8.x86_64",
      "repo_id": "baseos",
      "location": "Packages/c/chkconfig-1.19.2-1.el8.x86_64.rpm",
      "url": "https://download.rockylinux.org/pub/rocky/8.10/BaseOS/x86_64/os/Packages/c/chkconfig-1.19.2-1.el8.x86_64.rpm",
      "repository_checksum": {
        "algorithm": "sha256",
        "value": "351ccf6f957957b3284b74cef031b233b27f213d982002598cc25144b04042ee"
      },
      "sha256": "351ccf6f957957b3284b74cef031b233b27f213d982002598cc25144b04042ee",
      "size": 202232,
      "install_size": 827702,
      "source_rpm": "chkconfig-1.19.2-1.el8.src.rpm",
      "signing_key_fingerprint": "7051c470a929f454cebe37b715af5dac6d745a60",
      "reason": "dependency"
    },
    {
      "name": "coreutils",
      "epoch": 0,
      "version": "8.30",
      "release": "20.el8_10",
      "arch": "x86_64",
      "nevra": "coreutils-0:8.30-20.el8_10.x86_64",
      "repo_id": "baseos",
      "location": "Packages/c/coreutils-8.30-20.el8_10.x86_64.rpm",
      "url": "https://download.rockylinux.org/pub/rocky/8.10/BaseOS/x86_64/os/Packages/c/coreutils-8.30-20.el8_10.x86_64.rpm",
      "repository_checksum": {
        "algorithm": "sha256",
        "value": "967371c4b5b32bd665196f0cfe9ad674d5fd772cacf10b3b877426f874d191b7"
      },
      "sha256": "967371c4b5b32bd665196f0cfe9ad674d5fd772cacf10b3b877426f874d191b7",
      "size": 1272536,
      "install_size": 6108152,
      "source_rpm": "coreutils-8.30-20.el8_10.src.rpm",
      "signing_key_fingerprint": "7051c470a929f454cebe37b715af5dac6d745a60",
      "reason": "dependency"
    },
    {
      "name": "coreutils-common",
      "epoch": 0,
      "version": "8.30",
      "release": "20.el8_10",
      "arch": "x86_64",
      "nevra": "coreutils-common-0:8.30-20.el8_10.x86_64",
      "repo_id": "baseos",
      "location": "Packages/c/coreutils-common-8.30-20.el8_10.x86_64.rpm",
      "url": "https://download.rockylinux.org/pub/rocky/8.10/BaseOS/x86_64/os/Packages/c/coreutils-common-8.30-20.el8_10.x86_64.rpm",
      "repository_checksum": {
        "algorithm": "sha256",
        "value": "80bc27669940ab02d50f4568f41acfbeb4541ebdf7cba619d88d1af09d7febcb"
      },
      "sha256": "80bc27669940ab02d50f4568f41acfbeb4541ebdf7cba619d88d1af09d7febcb",
      "size": 2092376,